{
  "kind": "core",
  "slug": "pricing",
  "status": "published",
  "title": "MyRecon Pricing: Free Standard & ₹99 Extended Scans",
  "description": "Free accounts get 5 standard scans a day with sign-in. Pay ₹99 for unlimited standard scans, Deep Search and 10 Extended scans across 3,000+ platforms.",
  "h1": "Free standard scans and one Extended scan pack",
  "focus_keyword": "OSINT lookup pricing",
  "intro": "Guests get 5 free Quick scans daily across 100 platforms with no sign-up required. Only the first 2 result cards are visible; remaining cards are blurred. Standard scans require sign-in. Signed-in free accounts get 5 standard 500+ platform scans per day with complete results. The paid pack is ₹99 through Indian checkout, or US$3.99 through PayPal or Buy Me a Coffee when the chosen checkout is enabled: unlimited standard scans, Deep Search and 10 Extended scans across 3,000+ platforms each. Paid standard and Deep Search access continue after the Extended credits are used. Credits never expire and nothing auto-renews. Daily allowances reset at midnight UTC.",
  "sections": [
    {
      "heading": "Free standard results with sign-in",
      "body": "Guests get 5 free Quick scans daily across 100 platforms with no sign-up required. Only the first 2 result cards are visible; remaining cards are blurred. Standard scans require sign-in. Signed-in free accounts get 5 standard 500+ platform scans per day with complete results. The paid pack is ₹99 through Indian checkout, or US$3.99 through PayPal or Buy Me a Coffee when the chosen checkout is enabled: unlimited standard scans, Deep Search and 10 Extended scans across 3,000+ platforms each. Paid standard and Deep Search access continue after the Extended credits are used. Credits never expire and nothing auto-renews. Daily allowances reset at midnight UTC."
    },
    {
      "heading": "Match scan scope to your task",
      "body": "Match the plan to the task you actually have. For a one-off public username self-audit, begin with the available scanner and review its current scope; choose a larger or account-based option only when its documented limits meet your needs."
    },
    {
      "heading": "Confirm current terms before choosing",
      "body": "Do not rely on an old screenshot or copied plan description. Check the current product notice, record the date if you are comparing plans, and contact MyRecon through its current support route when a term is unclear."
    }
  ],
  "sources": [
    "https://www.myrecon.xyz/"
  ],
  "reviewed_at": "2026-09-30",
  "modified_at": "2026-09-30",
  "reviewer": "Codex editorial pass",
  "cta": {
    "label": "Search a public username with MyRecon",
    "href": "/"
  },
  "faq": [
    {
      "question": "What does MyRecon provide for OSINT lookup pricing?",
      "answer": "Guests get 5 free Quick scans daily across 100 platforms with no sign-up required. Only the first 2 result cards are visible; remaining cards are blurred. Standard scans require sign-in. Signed-in free accounts get 5 standard 500+ platform scans per day with complete results. The paid pack is ₹99 through Indian checkout, or US$3.99 through PayPal or Buy Me a Coffee when the chosen checkout is enabled: unlimited standard scans, Deep Search and 10 Extended scans across 3,000+ platforms each. Paid standard and Deep Search access continue after the Extended credits are used. Credits never expire and nothing auto-renews. Daily allowances reset at midnight UTC."
    },
    {
      "question": "Does a missing username result prove no account exists?",
      "answer": "No. A site may block, rate-limit, rename, or restrict a profile, and some services may not be supported. Treat an unavailable or missing result as inconclusive unless the source provides a verifiable reason."
    },
    {
      "question": "Can MyRecon see private accounts?",
      "answer": "No. Public username checks do not grant access to private accounts or restricted content. Use service-approved access and consent, and do not bypass login walls or platform controls to complete a search."
    }
  ],
  "product_claims": [
    "Guests get 5 free Quick scans daily across 100 platforms with no sign-up required. Only the first 2 result cards are visible; remaining cards are blurred. Standard scans require sign-in. Signed-in free accounts get 5 standard 500+ platform scans per day with complete results. The paid pack is ₹99 through Indian checkout, or US$3.99 through PayPal or Buy Me a Coffee when the chosen checkout is enabled: unlimited standard scans, Deep Search and 10 Extended scans across 3,000+ platforms each. Paid standard and Deep Search access continue after the Extended credits are used. Credits never expire and nothing auto-renews. Daily allowances reset at midnight UTC.",
    "MyRecon supports a public username lookup workflow for checks available through its current platform catalogue; individual sites can be unavailable or change their behavior.",
    "A result is a candidate for manual verification, not proof that a named person controls an account or that no account exists when no result appears."
  ]
}
