{
  "kind": "core",
  "slug": "home",
  "status": "published",
  "title": "Free OSINT Tool & Digital Footprint Search | MyRecon",
  "description": "Free OSINT tool for digital footprint audits and username reconnaissance across 500+ platforms. Check email breach exposure, DNS and IPs. Start free online.",
  "h1": "Free OSINT tool & username search",
  "focus_keyword": "free osint tool",
  "intro": "MyRecon helps you review public username matches across supported sites. Enter a handle you own or are authorized to check, open any candidate at its source, and treat blocked or ambiguous checks as unknown.",
  "sections": [
    {
      "heading": "Public username search",
      "body": "A public username lookup starts from a handle and returns candidate pages only when a supported source can be checked. Coverage and availability vary by platform, so confirm the current profile instead of treating a missing result as proof that no account exists."
    },
    {
      "heading": "Review each result at its source",
      "body": "Use the current MyRecon scanner for a self-audit or authorized review. This page explains the public-search workflow and its limits; it does not provide private-account discovery or guarantee a person's identity from a username."
    },
    {
      "heading": "Use public sources responsibly",
      "body": "A responsible result review records the source URL, date, and visible evidence. Keep the task scoped, avoid bypassing platform controls, and leave blocked or uncertain checks unresolved."
    }
  ],
  "sources": [
    "https://www.myrecon.xyz/"
  ],
  "reviewed_at": "2026-09-27",
  "modified_at": "2026-09-30",
  "reviewer": "Codex editorial pass",
  "cta": {
    "label": "Search a public username with MyRecon",
    "href": "/"
  },
  "faq": [
    {
      "question": "What is a reverse username lookup and how does it work?",
      "answer": "A reverse username lookup queries public endpoint URLs across 500+ social networks, developer communities, and forums to determine where a specific handle or alias is registered. Read our <a href=\"/blog/reverse-username-lookup-guide.html\">reverse username lookup guide</a>."
    },
    {
      "question": "What is a digital footprint check?",
      "answer": "A digital footprint check audits your public online exposure by scanning registered usernames, checking whether your email was involved in data breaches, and identifying leaked credentials. See our <a href=\"/blog/digital-footprint-checker-guide.html\">digital footprint audit guide</a>."
    },
    {
      "question": "Is MyRecon free to use?",
      "answer": "MyRecon offers free guest Quick scans across 100 platforms, with no sign-up required. Only the first 2 result cards are visible; remaining cards are blurred. Standard scans across 500+ platforms require sign-in. Paid plans add Deep Search and Extended scans. See the current pricing page for features and limits."
    },
    {
      "question": "Does a username lookup confirm availability?",
      "answer": "No. MyRecon checks public profile presence. A missing profile does not guarantee that a handle can be registered. Confirm username availability through the official platform signup or account settings flow."
    },
    {
      "question": "What is a social media username checker?",
      "answer": "A social media username checker looks for public profiles using a handle across supported platforms. MyRecon helps you review those profile leads for your own digital footprint or authorized research. Verify important matches at the source."
    },
    {
      "question": "What can I check with MyRecon?",
      "answer": "MyRecon includes public username, email and breach, password exposure, domain registration, DNS, and IP checks. Coverage and access can vary by tool, so use the live interface and current plan page to confirm what is available."
    },
    {
      "question": "Does a missing username result prove no account exists?",
      "answer": "No. A site may block, rate-limit, rename, or restrict a profile, and some services may not be supported. Treat an unavailable or missing result as inconclusive unless the source provides a verifiable reason."
    },
    {
      "question": "Can MyRecon confirm that a profile belongs to a person?",
      "answer": "No. A matching username is only a lead. Confirm important conclusions with independent public evidence and keep uncertain links unconfirmed. MyRecon does not access private accounts or restricted content."
    }
  ],
  "product_claims": [
    "MyRecon supports a public username lookup workflow for checks available through its current platform catalogue; individual sites can be unavailable or change their behavior.",
    "A result is a candidate for manual verification, not proof that a named person controls an account or that no account exists when no result appears."
  ]
}
